EVOFORMER NEURAL ODE TRAINING REPORT
==================================================

⏰ INTERRUPTED AT 73 EPOCHS (TIME LIMIT REACHED)
==================================================

Experiment: jumbo_ode__20250616_180845
Started: 2025-06-16 18:08:48
Completed: 2025-06-17 11:48:35
Total Training Time: 1059.8 minutes (17.7 hours)
Report generated: 2025-06-17 11:48:35

Configuration Settings:
------------------------------
  data_dir: N/A
  splits_dir: /home/visitor/PycharmProjects/openFold/neural_ODE/data_splits/jumbo
  mode: N/A
  output_dir: /home/visitor/PycharmProjects/openFold/neural_ODE/trained_models
  use_fast_ode: False
  reduced_cluster_size: 64
  hidden_dim: 64
  model_parameters: 854854
  model_type: EvoformerODEFunc
  epochs: 1000
  learning_rate: 0.001
  batch_size: N/A
  integrator: rk4
  use_amp: True
  max_residues: None
  loss_function: Adaptive MSE
  train_proteins: 492
  val_proteins: 50
  use_sequential_loading: False
  aggressive_cleanup: True
  preliminary_training_enabled: True
  prelim_data_dir: /media/visitor/Extreme SSD/data/complete_blocks
  prelim_block_stride: 4
  prelim_max_epochs: 20
  batch size: 2
  prelim_early_stopping_min_delta: N/A

System Information:
------------------------------
  cuda_available: True
  device: cuda
  pytorch_version: 2.1.2
  gpu_name: Quadro P4000
  cuda_version: 12.1
  total_gpu_memory: 7.9 GB

PRELIMINARY TRAINING PHASE
==================================================

Preliminary Started: 2025-06-16 18:08:48
Preliminary Completed: 2025-06-16 20:44:33
Preliminary Duration: 155.8 minutes

Preliminary Training Progress:
------------------------------
Epoch    Train Loss     Train Success  Val Loss       Val Success    Duration (s)
----------------------------------------------------------------------------------------
1        17.76959       16/80          64.32142       24/24          486.6       
2        14.71432       13/80          58.34734       23/23          475.6       
3        12.99980       12/80          49.77929       23/23          463.0       
4        13.13604       15/80          43.97322       24/24          472.3       
5        10.37522       13/80          36.68259       23/23          461.7       
6        9.00855        17/80          25.71521       22/22          441.6       
7        6.45830        15/80          22.51527       23/23          471.7       
8        5.50783        16/80          20.27781       24/24          486.0       
9        4.87516        16/80          18.89818       24/24          482.5       
10       4.84302        16/80          17.96524       23/23          469.5       
11       4.47936        15/80          16.71144       21/21          440.8       
12       4.38469        16/80          16.89282       20/20          441.0       
13       4.39461        18/80          15.33948       23/23          466.1       
14       4.16498        18/80          15.02258       24/24          489.6       
15       3.79503        15/80          14.34012       24/24          483.3       
16       3.56170        15/80          14.51589       22/22          474.0       
17       3.65247        16/80          13.09146       23/23          455.4       
18       3.31395        14/80          13.59990       24/24          476.6       
19       3.64424        17/80          12.99593       22/22          439.6       
20       3.54000        17/80          13.32637       22/22          468.7       
----------------------------------------------------------------------------------------

Preliminary Training Analysis:
------------------------------
Best Preliminary Epoch: 18 (Loss: 3.31395)
Worst Preliminary Epoch: 1 (Loss: 17.76959)
Final Preliminary Success Rate: 21.2%
Final Preliminary Validation Success Rate: 100.0%

MAIN TRAINING PHASE
==================================================

Main Training Started: 2025-06-16 20:44:33
Main Training Completed: 2025-06-17 11:48:35
Main Training Duration: 904.0 minutes

Main Training Progress:
------------------------------
Epoch    Train Loss     Train Success  Val Loss       Val Success    Duration (s)
----------------------------------------------------------------------------------------
1        204.28939      333/492        49.52227       41/41          940.6       
2        33.10528       330/492        45.84035       47/47          935.1       
3        31.09257       323/492        43.67630       44/44          934.5       
4        29.60607       331/492        42.21328       46/46          933.1       
5        29.08114       349/492        41.22664       49/49          797.3       
6        28.95062       368/492        40.43341       49/49          738.6       
7        28.31705       368/492        39.47003       49/49          739.4       
8        27.51493       368/492        38.24826       49/49          739.7       
9        26.70962       368/492        37.66815       49/49          739.4       
10       26.08514       368/492        36.94776       49/49          739.3       
11       25.48872       368/492        36.50148       49/49          739.5       
12       25.03575       368/492        35.55710       49/49          739.6       
13       24.76192       368/492        34.89482       49/49          739.6       
14       24.37106       368/492        34.28203       49/49          740.2       
15       24.17763       368/492        34.01044       49/49          740.3       
16       23.86364       368/492        33.47149       49/49          740.0       
17       23.65091       368/492        33.11585       49/49          740.3       
18       23.38567       368/492        32.75564       49/49          740.2       
19       23.21088       368/492        32.48839       49/49          740.0       
20       23.02970       368/492        32.23782       49/49          740.4       
21       22.89260       368/492        32.15256       49/49          740.0       
22       22.74590       368/492        31.94639       49/49          740.6       
23       22.68122       368/492        31.72211       49/49          740.6       
24       22.48837       368/492        31.56839       49/49          740.6       
25       22.32306       368/492        31.45678       49/49          740.9       
26       22.24482       368/492        31.41910       49/49          741.0       
27       22.10400       368/492        31.21209       49/49          741.0       
28       21.90777       368/492        30.90822       49/49          740.7       
29       21.75595       368/492        31.07594       49/49          742.6       
30       21.64940       368/492        30.62840       49/49          740.9       
31       21.51551       368/492        30.62577       49/49          741.2       
32       21.35485       368/492        30.46761       49/49          741.1       
33       21.19368       368/492        30.20074       49/49          741.2       
34       21.14447       368/492        29.97303       49/49          741.4       
35       21.01076       368/492        30.02253       49/49          741.1       
36       20.91834       368/492        29.81780       49/49          743.8       
37       20.76915       368/492        29.81201       49/49          743.3       
38       20.67692       368/492        29.56575       49/49          743.0       
39       20.56134       368/492        29.67384       49/49          741.9       
40       20.51766       368/492        29.41101       49/49          742.8       
41       20.43119       368/492        29.51736       49/49          743.3       
42       20.36191       368/492        29.34197       49/49          742.8       
43       20.33356       369/492        29.17914       49/49          743.9       
44       20.23853       369/492        29.37042       49/49          743.5       
45       20.16367       369/492        29.09660       49/49          743.4       
46       20.11568       369/492        28.94969       49/49          744.2       
47       19.91259       367/492        28.97115       49/49          742.4       
48       19.86782       367/492        28.91456       49/49          742.7       
49       19.83496       367/492        28.63229       49/49          742.5       
50       19.72045       367/492        28.54670       49/49          742.3       
51       19.66148       367/492        28.43401       49/49          742.2       
52       19.55023       367/492        28.48187       49/49          742.6       
53       19.48889       367/492        28.51637       49/49          742.9       
54       19.42926       367/492        28.44514       49/49          742.8       
55       18.98080       367/492        27.35187       49/49          742.5       
56       18.87208       367/492        27.33737       49/49          742.6       
57       18.78002       367/492        27.25909       49/49          743.3       
58       18.69696       367/492        27.25216       49/49          743.1       
59       18.66307       367/492        27.20386       49/49          742.9       
60       18.60768       367/492        27.16031       49/49          742.4       
61       18.55677       367/492        27.15923       49/49          742.4       
62       18.50081       367/492        27.12814       49/49          742.8       
63       18.46672       367/492        27.14449       49/49          742.3       
64       18.41790       367/492        27.00880       49/49          742.4       
65       18.36997       367/492        27.00472       49/49          742.3       
66       18.31701       367/492        26.95362       49/49          742.7       
67       18.30124       367/492        27.01788       49/49          742.6       
68       18.24881       367/492        26.93708       49/49          742.8       
69       18.19519       367/492        26.89033       49/49          742.7       
70       18.17788       367/492        26.97894       49/49          743.5       
71       18.13437       367/492        26.83480       49/49          743.3       
72       17.91732       364/492        26.88681       49/49          746.8       
----------------------------------------------------------------------------------------

Main Training Analysis:
------------------------------
Best Main Training Epoch: 72 (Loss: 17.91732)
Worst Main Training Epoch: 1 (Loss: 204.28939)
Final Main Training Success Rate: 74.0%
Final Main Training Validation Success Rate: 100.0%

OVERALL TRAINING SUMMARY
==================================================

OVERALL PERFORMANCE ANALYSIS
------------------------------
Best Overall Epoch: Preliminary Epoch 18 (Loss: 3.31395)
Worst Overall Epoch: Main Epoch 1 (Loss: 204.28939)
Overall Training Improvement: 61.6x better from worst to best
Final Training Success Rate: 74.0%
Final Validation Success Rate: 100.0%

FINAL MODEL
------------------------------
Model saved to: /home/visitor/PycharmProjects/openFold/neural_ODE/trained_models/jumbo_ode__20250616_180845_final_model.pt
Total parameters: 854854
Model type: EvoformerODEFunc
⏰ Training was interrupted at epoch 73 due to time limit
Model represents the best state found before timeout

==================================================
