EVOFORMER NEURAL ODE TRAINING REPORT
==================================================

⏰ INTERRUPTED AT 73 EPOCHS (TIME LIMIT REACHED)
==================================================

Experiment: 20250617_180948_fast_ode_with_prelim
Started: 2025-06-17 18:09:50
Completed: 2025-06-18 09:19:37
Total Training Time: 909.8 minutes (15.2 hours)
Report generated: 2025-06-18 09:19:37

Configuration Settings:
------------------------------
  data_dir: N/A
  splits_dir: /home/visitor/PycharmProjects/openFold/neural_ODE/data_splits/jumbo
  mode: N/A
  output_dir: /home/visitor/PycharmProjects/openFold/neural_ODE/trained_models
  use_fast_ode: True
  reduced_cluster_size: 64
  hidden_dim: 64
  model_parameters: 117378
  model_type: EvoformerODEFuncFast
  epochs: 10000
  learning_rate: 0.001
  batch_size: N/A
  integrator: rk4
  use_amp: True
  max_residues: None
  loss_function: Adaptive MSE
  train_proteins: 492
  val_proteins: 50
  use_sequential_loading: False
  aggressive_cleanup: True
  preliminary_training_enabled: True
  prelim_data_dir: /media/visitor/Extreme SSD/data/complete_blocks
  prelim_block_stride: 4
  prelim_max_epochs: 20
  prelim_early_stopping_min_delta: N/A

System Information:
------------------------------
  cuda_available: True
  device: cuda
  pytorch_version: 2.1.2
  gpu_name: Quadro P4000
  cuda_version: 12.1
  total_gpu_memory: 7.9 GB

PRELIMINARY TRAINING PHASE
==================================================

Preliminary Started: 2025-06-17 18:09:50
Preliminary Completed: 2025-06-17 21:25:47
Preliminary Duration: 196.0 minutes

Preliminary Training Progress:
------------------------------
Epoch    Train Loss     Train Success  Val Loss       Val Success    Duration (s)
----------------------------------------------------------------------------------------
1        42.75019       59/80          69.38428       25/25          595.6       
2        37.32581       59/80          56.18263       25/25          594.7       
3        29.90076       59/80          44.95226       25/25          591.8       
4        22.84238       59/80          32.15468       25/25          588.2       
5        16.10489       59/80          23.49508       25/25          586.9       
6        12.45139       59/80          19.34537       25/25          587.7       
7        10.88543       59/80          17.80041       25/25          587.0       
8        10.21829       59/80          16.80681       25/25          586.5       
9        9.67757        59/80          15.88691       25/25          586.6       
10       9.11682        59/80          14.93397       25/25          586.2       
11       8.56063        59/80          14.04941       25/25          586.5       
12       8.08022        59/80          13.36106       25/25          586.6       
13       7.75621        59/80          12.94854       25/25          586.4       
14       7.56836        59/80          12.70292       25/25          586.9       
15       7.43822        59/80          12.51224       25/25          586.6       
16       7.32186        59/80          12.33258       25/25          586.8       
17       7.20322        59/80          12.14386       25/25          587.0       
18       7.07727        59/80          11.94382       25/25          586.7       
19       6.94893        59/80          11.74517       25/25          586.4       
20       6.82625        59/80          11.55790       25/25          586.5       
----------------------------------------------------------------------------------------

Preliminary Training Analysis:
------------------------------
Best Preliminary Epoch: 20 (Loss: 6.82625)
Worst Preliminary Epoch: 1 (Loss: 42.75019)
Final Preliminary Success Rate: 73.8%
Final Preliminary Validation Success Rate: 100.0%

MAIN TRAINING PHASE
==================================================

Main Training Started: 2025-06-17 21:25:47
Main Training Completed: 2025-06-18 09:19:37
Main Training Duration: 713.8 minutes

Main Training Progress:
------------------------------
Epoch    Train Loss     Train Success  Val Loss       Val Success    Duration (s)
----------------------------------------------------------------------------------------
1        141.21602      480/492        60.97255       50/50          595.6       
2        51.98047       480/492        54.21155       50/50          595.2       
3        48.54797       480/492        52.13602       50/50          594.9       
4        47.59348       480/492        51.66374       50/50          593.5       
5        47.23670       480/492        51.16686       50/50          592.7       
6        46.93626       480/492        51.15256       50/50          592.9       
7        46.63181       480/492        51.06551       50/50          591.9       
8        46.25593       480/492        50.51123       50/50          592.3       
9        45.64520       480/492        49.14703       50/50          591.8       
10       44.83496       480/492        48.47762       50/50          591.9       
11       44.25047       480/492        47.98696       50/50          592.2       
12       43.89978       480/492        47.60713       50/50          592.0       
13       43.54945       480/492        47.05593       50/50          592.1       
14       43.27845       480/492        46.75624       50/50          591.9       
15       42.88035       480/492        45.98269       50/50          591.8       
16       42.45607       480/492        44.96983       50/50          592.5       
17       41.41246       480/492        44.18072       50/50          591.8       
18       41.08267       480/492        43.40897       50/50          592.2       
19       40.39591       480/492        43.01219       50/50          592.7       
20       39.42548       480/492        42.16540       50/50          592.5       
21       38.61053       480/492        41.70905       50/50          593.0       
22       38.12546       480/492        41.47371       50/50          592.9       
23       37.71258       480/492        41.07867       50/50          593.4       
24       37.39492       480/492        40.71573       50/50          592.8       
25       37.11537       480/492        40.46263       50/50          593.1       
26       36.87038       480/492        40.22622       50/50          593.5       
27       36.64730       480/492        40.04757       50/50          593.3       
28       36.46620       480/492        39.88778       50/50          593.8       
29       36.26508       480/492        39.71500       50/50          593.4       
30       36.09237       480/492        39.54970       50/50          594.1       
31       35.94100       480/492        39.37141       50/50          593.9       
32       35.82412       480/492        39.18966       50/50          594.0       
33       35.68992       480/492        39.02967       50/50          594.2       
34       35.58402       480/492        38.88559       50/50          594.5       
35       35.48131       480/492        38.73591       50/50          594.1       
36       35.38277       480/492        38.63091       50/50          594.5       
37       35.28868       480/492        38.53785       50/50          594.4       
38       35.19320       480/492        38.46682       50/50          595.1       
39       35.10796       480/492        38.40717       50/50          594.9       
40       35.02755       480/492        38.32241       50/50          594.9       
41       34.94902       480/492        38.26837       50/50          595.1       
42       34.85426       480/492        38.15043       50/50          595.0       
43       34.75709       480/492        38.06399       50/50          595.2       
44       34.65415       480/492        37.95394       50/50          595.1       
45       34.54563       480/492        37.90954       50/50          595.4       
46       34.42872       480/492        37.75912       50/50          595.5       
47       34.32715       480/492        37.68127       50/50          595.3       
48       34.24063       480/492        37.58235       50/50          596.0       
49       34.14911       480/492        37.46101       50/50          596.0       
50       34.05770       480/492        37.33471       50/50          596.1       
51       33.96999       480/492        37.21811       50/50          596.4       
52       33.88160       480/492        37.07426       50/50          596.2       
53       33.78922       480/492        36.96328       50/50          596.7       
54       33.70773       480/492        36.87792       50/50          596.5       
55       33.62802       480/492        36.78643       50/50          596.7       
56       33.54870       480/492        36.71479       50/50          596.7       
57       33.47213       480/492        36.63884       50/50          596.6       
58       33.39802       480/492        36.57079       50/50          597.0       
59       33.32284       480/492        36.49977       50/50          597.0       
60       33.25024       480/492        36.40659       50/50          596.9       
61       33.18595       480/492        36.37085       50/50          597.7       
62       33.12862       480/492        36.36936       50/50          597.2       
63       33.07392       480/492        36.28572       50/50          597.8       
64       33.03482       480/492        36.26820       50/50          597.2       
65       32.98287       480/492        36.18631       50/50          597.7       
66       32.93996       480/492        36.13097       50/50          598.2       
67       32.89637       480/492        36.04490       50/50          597.8       
68       32.85749       480/492        35.97338       50/50          598.4       
69       32.80948       480/492        35.91947       50/50          598.6       
70       32.76395       480/492        35.86606       50/50          598.1       
71       32.71972       480/492        35.81297       50/50          598.4       
72       32.67782       480/492        35.76450       50/50          598.5       
----------------------------------------------------------------------------------------

Main Training Analysis:
------------------------------
Best Main Training Epoch: 72 (Loss: 32.67782)
Worst Main Training Epoch: 1 (Loss: 141.21602)
Final Main Training Success Rate: 97.6%
Final Main Training Validation Success Rate: 100.0%

OVERALL TRAINING SUMMARY
==================================================

OVERALL PERFORMANCE ANALYSIS
------------------------------
Best Overall Epoch: Preliminary Epoch 20 (Loss: 6.82625)
Worst Overall Epoch: Main Epoch 1 (Loss: 141.21602)
Overall Training Improvement: 20.7x better from worst to best
Final Training Success Rate: 97.6%
Final Validation Success Rate: 100.0%

FINAL MODEL
------------------------------
Model saved to: /home/visitor/PycharmProjects/openFold/neural_ODE/trained_models/20250617_180948_fast_ode_with_prelim_final_model.pt
Total parameters: 117378
Model type: EvoformerODEFuncFast
⏰ Training was interrupted at epoch 73 due to time limit
Model represents the best state found before timeout

==================================================
