EVOFORMER NEURAL ODE TRAINING REPORT
==================================================

⏰ INTERRUPTED AT 71 EPOCHS (TIME LIMIT REACHED)
==================================================

Experiment: 20250618_174724_full_ode_with_prelim2
Started: 2025-06-18 17:47:29
Completed: 2025-06-19 10:52:25
Total Training Time: 1024.9 minutes (17.1 hours)
Report generated: 2025-06-19 10:52:25

Configuration Settings:
------------------------------
  data_dir: N/A
  splits_dir: /home/visitor/PycharmProjects/openFold/neural_ODE/data_splits/jumbo
  mode: N/A
  output_dir: /home/visitor/PycharmProjects/openFold/neural_ODE/trained_models
  use_fast_ode: False
  reduced_cluster_size: 64
  hidden_dim: 64
  model_parameters: 869021
  model_type: EvoformerODEFunc
  epochs: 10000
  learning_rate: 0.001
  batch_size: N/A
  integrator: rk4
  use_amp: True
  max_residues: None
  loss_function: Adaptive MSE
  train_proteins: 492
  val_proteins: 50
  use_sequential_loading: False
  aggressive_cleanup: True
  preliminary_training_enabled: True
  prelim_data_dir: /media/visitor/Extreme SSD/data/complete_blocks
  prelim_block_stride: 4
  batch size: 2
  prelim_max_epochs: 20
  prelim_early_stopping_min_delta: N/A

System Information:
------------------------------
  cuda_available: True
  device: cuda
  pytorch_version: 2.1.2
  gpu_name: Quadro P4000
  cuda_version: 12.1
  total_gpu_memory: 7.9 GB

PRELIMINARY TRAINING PHASE
==================================================

Preliminary Started: 2025-06-18 17:47:29
Preliminary Completed: 2025-06-18 19:52:57
Preliminary Duration: 125.5 minutes

Preliminary Training Progress:
------------------------------
Epoch    Train Loss     Train Success  Val Loss       Val Success    Duration (s)
----------------------------------------------------------------------------------------
1        23.63481       18/80          79.58262       24/24          383.2       
2        20.75547       18/80          67.70886       24/24          377.1       
3        16.90011       18/80          53.85877       24/24          378.1       
4        12.94199       18/80          40.34908       24/24          379.0       
5        9.34905        18/80          29.58486       24/24          381.0       
6        7.08190        18/80          23.46155       24/24          379.9       
7        5.91553        18/80          21.07306       24/24          379.9       
8        5.42889        18/80          19.79656       24/24          378.5       
9        5.16364        18/80          18.95143       24/24          373.7       
10       4.96012        18/80          18.20680       24/24          374.3       
11       4.75045        18/80          17.35119       24/24          373.4       
12       4.52035        18/80          16.45227       24/24          375.5       
13       4.31214        18/80          15.75733       24/24          374.6       
14       4.16669        18/80          15.34658       24/24          374.5       
15       4.06645        18/80          15.07586       24/24          373.4       
16       3.99521        18/80          14.85698       24/24          373.8       
17       3.93803        18/80          14.70141       24/24          373.5       
18       3.88465        18/80          14.54335       24/24          375.4       
19       3.82714        18/80          14.38072       24/24          374.9       
20       3.76211        18/80          14.19233       24/24          374.8       
----------------------------------------------------------------------------------------

Preliminary Training Analysis:
------------------------------
Best Preliminary Epoch: 20 (Loss: 3.76211)
Worst Preliminary Epoch: 1 (Loss: 23.63481)
Final Preliminary Success Rate: 22.5%
Final Preliminary Validation Success Rate: 100.0%

MAIN TRAINING PHASE
==================================================

Main Training Started: 2025-06-18 19:52:57
Main Training Completed: 2025-06-19 10:52:25
Main Training Duration: 899.5 minutes

Main Training Progress:
------------------------------
Epoch    Train Loss     Train Success  Val Loss       Val Success    Duration (s)
----------------------------------------------------------------------------------------
1        258.36183      371/492        55.31942       49/49          766.5       
2        36.00433       371/492        45.95066       49/49          768.9       
3        32.65158       371/492        44.07960       49/49          766.1       
4        30.53452       371/492        41.94541       49/49          769.0       
5        29.54906       371/492        40.87728       49/49          768.7       
6        28.81667       371/492        39.84546       49/49          768.1       
7        28.12797       371/492        38.96230       49/49          768.2       
8        27.45724       371/492        37.94913       49/49          769.1       
9        27.01532       371/492        37.36862       49/49          770.9       
10       26.54255       371/492        36.60998       49/49          769.4       
11       26.15019       371/492        36.15253       49/49          767.5       
12       25.78890       371/492        35.64258       49/49          767.9       
13       25.39600       371/492        35.42086       49/49          769.0       
14       25.12196       371/492        35.03795       49/49          768.5       
15       24.86329       371/492        34.89656       49/49          769.3       
16       24.65860       371/492        34.51071       49/49          769.7       
17       24.61051       371/492        34.38772       49/49          769.2       
18       24.28450       371/492        34.23519       49/49          769.0       
19       24.27297       371/492        34.15882       49/49          771.0       
20       24.11336       371/492        33.84165       49/49          769.7       
21       23.99198       371/492        33.71580       49/49          769.6       
22       23.79117       371/492        33.59884       49/49          769.5       
23       23.83566       371/492        33.62735       49/49          770.0       
24       23.72177       371/492        33.56946       49/49          770.0       
25       23.63160       371/492        33.35748       49/49          769.4       
26       23.48756       371/492        33.18123       49/49          772.0       
27       23.35320       371/492        33.23361       49/49          769.7       
28       23.17905       371/492        32.77728       49/49          771.3       
29       22.97868       371/492        32.63177       49/49          770.9       
30       22.86039       371/492        32.43112       49/49          769.2       
31       22.64820       371/492        32.21442       49/49          770.4       
32       22.59034       371/492        32.25922       49/49          770.5       
33       22.44150       371/492        32.12947       49/49          771.9       
34       22.35740       371/492        31.97053       49/49          771.7       
35       22.21874       371/492        31.85730       49/49          772.2       
36       22.19238       371/492        31.70086       49/49          770.4       
37       22.00678       371/492        31.66373       49/49          772.3       
38       21.97048       371/492        31.37531       49/49          771.5       
39       21.90262       371/492        31.63542       49/49          770.7       
40       21.93107       371/492        31.60013       49/49          770.9       
41       21.83364       371/492        31.22802       49/49          771.3       
42       21.77867       371/492        31.06995       49/49          771.0       
43       21.62016       371/492        30.87522       49/49          771.1       
44       21.55954       371/492        30.82017       49/49          769.9       
45       21.55029       371/492        30.76402       49/49          772.0       
46       21.42189       371/492        30.74241       49/49          771.4       
47       21.45492       371/492        30.69223       49/49          772.4       
48       21.50438       372/492        30.69097       49/49          775.1       
49       21.50612       372/492        30.43837       49/49          773.4       
50       21.42195       372/492        30.68137       49/49          774.1       
51       21.34445       372/492        30.48983       49/49          772.6       
52       21.35481       372/492        30.53177       49/49          772.7       
53       20.96047       372/492        29.85660       49/49          773.3       
54       20.85904       372/492        29.93580       49/49          774.0       
55       20.81599       372/492        29.78552       49/49          771.1       
56       20.77517       372/492        29.85149       49/49          772.3       
57       20.75003       372/492        29.81003       49/49          771.5       
58       20.69662       372/492        29.82426       49/49          769.6       
59       20.50601       372/492        29.63598       49/49          770.7       
60       20.46153       372/492        29.63754       49/49          774.0       
61       20.43525       372/492        29.65265       49/49          772.0       
62       20.41410       372/492        29.71496       49/49          773.2       
63       20.29417       372/492        29.76981       49/49          773.4       
64       20.27455       372/492        29.73757       49/49          771.9       
65       20.26139       372/492        29.72579       49/49          773.4       
66       20.19074       372/492        29.61992       49/49          774.6       
67       20.17818       372/492        29.59402       49/49          774.3       
68       20.17036       372/492        29.58592       49/49          774.1       
69       20.16309       372/492        29.57048       49/49          773.9       
70       20.15584       372/492        29.55772       49/49          774.0       
----------------------------------------------------------------------------------------

Main Training Analysis:
------------------------------
Best Main Training Epoch: 70 (Loss: 20.15584)
Worst Main Training Epoch: 1 (Loss: 258.36183)
Final Main Training Success Rate: 75.6%
Final Main Training Validation Success Rate: 100.0%

OVERALL TRAINING SUMMARY
==================================================

OVERALL PERFORMANCE ANALYSIS
------------------------------
Best Overall Epoch: Preliminary Epoch 20 (Loss: 3.76211)
Worst Overall Epoch: Main Epoch 1 (Loss: 258.36183)
Overall Training Improvement: 68.7x better from worst to best
Final Training Success Rate: 75.6%
Final Validation Success Rate: 100.0%

FINAL MODEL
------------------------------
Model saved to: /home/visitor/PycharmProjects/openFold/neural_ODE/trained_models/20250618_174724_full_ode_with_prelim2_final_model.pt
Total parameters: 869021
Model type: EvoformerODEFunc
⏰ Training was interrupted at epoch 71 due to time limit
Model represents the best state found before timeout

==================================================
